root@lamponubuntu2004-s-1vcpu-1gb-tor1-01:~# tcpdump -n -i eth0
.
.
.
.
13:11:25.080174 IP 147.182.148.152.22 > 99.244.73.56.58743: Flags [P.], seq 1769016:1769180, ack 325, win 501, length 164
13:11:25.080221 IP 147.182.148.152.22 > 99.244.73.56.58743: Flags [P.], seq 1769180:1769344, ack 325, win 501, length 164
13:11:25.080259 IP 147.182.148.152.22 > 99.244.73.56.58743: Flags [P.], seq 1769344:1769508, ack 325, win 501, length 164
13:11:25.080295 IP 147.182.148.152.22 > 99.244.73.56.58743: Flags [P.], seq 1769508:1769672, ack 325, win 501, length 164
13:11:25.080331 IP 147.182.148.152.22 > 99.244.73.56.58743: Flags [P.], seq 1769672:1769836, ack 325, win 501, length 164
13:11:25.080367 IP 147.182.148.152.22 > 99.244.73.56.58743: Flags [P.], seq 1769836:1770000, ack 325, win 501, length 164
13:11:25.080407 IP 147.182.148.152.22 > 99.244.73.56.58743: Flags [P.], seq 1770000:1770164, ack 325, win 501, length 164
13:11:25.080444 IP 147.182.148.152.22 > 99.244.73.56.58743: Flags [P.], seq 1770164:1770328, ack 325, win 501, length 164
13:11:25.080481 IP 147.182.148.152.22 > 99.244.73.56.58743: Flags [P.], seq 1770328:1770492, ack 325, win 501, length 164
13:11:25.080518 IP 147.182.148.152.22 > 99.244.73.56.58743: Flags [P.], seq 1770492:1770656, ack 325, win 501, length 164
13:11:25.080554 IP 147.182.148.152.22 > 99.244.73.56.58743: Flags [P.], seq 1770656:1770820, ack 325, win 501, length 164
13:11:25.080592 IP 147.182.148.152.22 > 99.244.73.56.58743: Flags [P.], seq 1770820:1770984, ack 325, win 501, length 164
13:11:25.080629 IP 147.182.148.152.22 > 99.244.73.56.58743: Flags [P.], seq 1770984:1771148, ack 325, win 501, length 164
13:11:25.080669 IP 147.182.148.152.22 > 99.244.73.56.58743: Flags [P.], seq 1771148:1771312, ack 325, win 501, length 164
13:11:25.080708 IP 147.182.148.152.22 > 99.244.73.56.58743: Flags [P.], seq 1771312:1771476, ack 325, win 501, length 164
13:11:25.080744 IP 147.182.148.152.22 > 99.244.73.56.58743: Flags [P.], seq 1771476:1771640, ack 325, win 501, length 164
13:11:25.080784 IP 147.182.148.152.22 > 99.244.73.56.58743: Flags [P.], seq 1771640:1771804, ack 325, win 501, length 164
13:11:25.080821 IP 147.182.148.152.22 > 99.244.73.56.58743: Flags [P.], seq 1771804:1771968, ack 325, win 501, length 164
13:11:25.080857 IP 147.182.148.152.22 > 99.244.73.56.58743: Flags [P.], seq 1771968:1772132, ack 325, win 501, length 164
13:11:25.080895 IP 147.182.148.152.22 > 99.244.73.56.58743: Flags [P.], seq 1772132:1772296, ack 325, win 501, length 164
13:11:25.080930 IP 147.182.148.152.22 > 99.244.73.56.58743: Flags [P.], seq 1772296:1772460, ack 325, win 501, length 164
13:11:25.080970 IP 147.182.148.152.22 > 99.244.73.56.58743: Flags [P.], seq 1772460:1772624, ack 325, win 501, length 164
13:11:25.081008 IP 147.182.148.152.22 > 99.244.73.56.58743: Flags [P.], seq 1772624:1772788, ack 325, win 501, length 164
13:11:25.081045 IP 147.182.148.152.22 > 99.244.73.56.58743: Flags [P.], seq 1772788:1772952, ack 325, win 501, length 164
13:11:25.081083 IP 147.182.148.152.22 > 99.244.73.56.58743: Flags [P.], seq 1772952:1773116, ack 325, win 501, length 164
13:11:25.081119 IP 147.182.148.152.22 > 99.244.73.56.58743: Flags [P.], seq 1773116:1773280, ack 325, win 501, length 164
13:11:25.081155 IP 147.182.148.152.22 > 99.244.73.56.58743: Flags [P.], seq 1773280:1773444, ack 325, win 501, length 164
13:11:25.081180 IP 99.244.73.56.58743 > 147.182.148.152.22: Flags [P.], seq 325:397, ack 1686644, win 3734, length 72
13:11:25.081180 IP 99.244.73.56.58743 > 147.182.148.152.22: Flags [.], ack 1689268, win 3724, length 0
^C
11144 packets captured
11145 packets received by filter
1 packet dropped by kernel
